,NewsContent,author,publishedDate,title,APPL_company,IBM_company,GOOGL_company,AMZN_company,MSFT_company,APPL_senti,IBM_senti,GOOGL_senti,AMZN_senti,MSFT_senti
61," InvestorPlace - Stock Market News, Stock Advice & Trading Tips Qualcomm (NASDAQ: QCOM ) stock has been on a smartphone roller coaster, and that ride has been bumpy lately, with smartphone sales declining while a legal battle with Apple (NASDAQ: AAPL ) rages on. Diversification into laptop and smartwatch processors has yet to pay off in a meaningful way, but now the company has another play: data centers. Yesterday, QCOM took the wraps off Qualcomm Cloud AI 100, a new processor aimed at data centers where artificial intelligence (AI) is increasingly important.  At an event on April 9, Qualcomm announced a new processor , targeting a new market for the company. The new Qualcomm Cloud AI 100 is aimed at data centers where AI is critical. The process known as ""AI inferencing"" is where already trained AI puts what it has learned to practical use. For example, AI inference is used to recognize images, to make recommendations to online shoppers or to translate speech into text. Qualcomm's approach is to use its expertise in designing the mobile processors used in smartphones, and apply this approach to AI. Smartphones require significant processing power in a very compact package, and it must be an extremely energy efficient design. The Qualcomm Cloud AI 100 isn't as powerful as the competition's AI inference chips, but it has two key advantages carried over from that smartphone expertise: less heat generated, and much lower power consumption. One of the biggest operational expenses of a datacenter is powering and cooling all the processors inside. That operation is so energy intensive that data centers are predicted to consume 20% of global electricity production by 2025 . QCOM says its Cloud AI 100's low energy requirements offers 10 times the power performance of competing chips. Expected to begin testing later this year with partners including Microsoft (NASDAQ: MSFT ), they are scheduled to go into production in 2020. Qualcomm says that with its manufacturing capability, it will be able to ramp up output to meet demand very quickly. The datacenter market is a big one, and within that broad category, the datacenter accelerator market - AI inference - was worth an estimated $2.84 billion in 2018. But it's forecast to grow at a CAGR of 49.47% to hit $21.19 billion by 2023 . That's just short of Qualcomm's $22.73 billion in total annual revenue for 2018. The potential payoff for QCOM is big, but so is the competition. The Qualcomm Cloud AI 100 will be going up against established datacenter powerhouses Nvidia (NASDAQ: NVDA ) and Intel (NASDAQ: INTC ). In addition, Reuters points out that tech giants, including Amazon (NASDAQ: AMZN ) and Alphabet's (NASDAQ: GOOG , NASDAQ: GOOGL ) Google are making their own AI inference chips . QCOM says it is focusing on the smaller data centers that are proliferating globally as mobile apps and other connected services push for faster response times. These smaller ""edge"" data centers lack the cooling infrastructure needed to power endless racks of Nvidia or Intel chips, they tend to be more cost sensitive and most don't need the same raw computational power a company like Google expects. The Qualcomm Cloud AI 100 with its high performance-per-watt is ideal for these edge data centers. QCOM's focus on the smartphone market took Qualcomm stock to near record heights in 2014, but since then it has been up and down. Currently, QCOM is off those 2014 levels by about 30%, but it has been trending up and InvestorPlace's Chris Tyler wrote it was a buy . That was a day before the Qualcomm Cloud AI 100 announcement. Add the company's new push into the lucrative data center market, and QCOM's future is definitely looking rosier. As of this writing, Brad Moon did not hold a position in any of the aforementioned securitie s. The post How Serious Is Qualcomm's Data Center Play? appeared first on InvestorPlace . ",InvestorPlace Media,"April 10, 2019, 10:19:41 AM EDT",How Serious Is Qualcomm’s Data Center Play?,0,0,0,0,0,1,0,-1,1,-1
62,"Top Technology Stocks: MSFT: +0.33% AAPL: -0.39% IBM: +0.27% CSCO: +0.13% GOOG: Flat Top technology stocks were mostly higher pre-market Wednesday. Stocks moving on news include: (+) Safe-T Group ( SFET  ), which was advancing more than 17% as it agreed to acquire NetNut Ltd., an Israeli-based provider of business proxy network services for $9.7 million, plus an additional earn-out payment in 2020. (+) IZEA ( IZEA  ), operator of IZEAx platform, was gaining more than 12% as i t report  ed bookings of $7.8 million for the first quarter of 2019, an 18% increase compared with $6.6 million in the same quarter of the prior year. During Q1, about 38% of bookings came from a combination of software licensing and marketplace spend. In other sector news: (+) Taiwan Semiconductor ( TSM  ) was slightly higher after reporting net revenue of TWD79.72 billion ($2.59 billion) in March, a 23.1% decline from TWD103.70 billion a year ago but a 30.9% increase from TWD60.89 billion in February.",MT Newswires,"April 10, 2019, 08:59:52 AM EDT","Technology Sector Update for 04/10/2019: SFET, IZEA, TSM, MSFT, AAPL, IBM, CSCO, GOOG",1,1,1,0,1,1,1,-1,1,-1
63,"Is it possible that the smartphones that have come to consume our lives are already knocking at the door of oblivion? The CEO of one of the world’s largest telecoms companies thinks so … Back in the 1970s, when the very first mobile phone was released, it weighed more than two pounds, was priced at almost $4,000 and took 10 hours to charge, after which one could hold a half-hour conversation before the battery died. Four decades later, and we have the smartphone, and no one can imagine life without them—or without all the bells and whistles, including everything from 3D facial recognition to state-of-the-art cameras. It’s gone far beyond making phone calls, an act that is going the way of the paper and pen itself. Which brings us to the latest prophetic statement from AT&T CEO Randall Stephenson, who opined earlier this month that the smartphone is a “crutch” that is doomed. Stephenson’s view is that we’re having another 1970s moment…when we realize that what we’ve developed is cool, but primitive and just the beginning of something much more sophisticated. And the sophistication comes in the form of … nothing tangible. ""We carry around these devices and they're bigger than they should be... I say they go away…It is conceivable that we're going to be moving into a world without screens, a world where glasses are your screen,” Stephenson said. According to the AT&T CEO, the advent of 5G--whose development is so significant that it’s become the stuff of political campaigning--will move all the storage and computing power of mobile phones from the device to the network, rendering the physical phone itself irrelevant. According to a recent Ericsson survey, 92 percent of executives from 100 major global telecom operators believe that 5G is the foundation for emerging new technologies not only for smartphones but also for self-driving cars, smart cities … the digital world that is clawing its way to the surface of our reality. What does it mean for phones, exactly? Well, not much in the next few years, at all, as the main carriers in the U.S. are just now in the process of preparing to launch 5G networks. In much of the world, 5G will be released later this year, with a number of phones unveiled to support the network, including the Huawei Mate X, LG V50 ThinQ, Samsung Galaxy S10 and a handful of others. Apple was reported to be sitting out the technology until at least 2020. Coverage will also be limited, and nationwide 5G coverage will take some time with some areas to be included closer to 2024. But as far ahead into the future as we can reasonably see, the sentiment is that smartphones will eventually be replaced by augmented reality glasses—the apparent elixir to our obsessive phone use (or will it just replace one obsession with another?) A number of big companies and emerging start-ups are already working in the field of smart and connected glasses, and quite of few are already on the market. They haven’t, though, attracted much of a customer base just yet. Take  Google Glass, for instance, or Microsoft’s HoloLens mixed reality headsets, which put you in touch with your favorite holograms but aren’t intended for walking around with; rather, they are for professionals taking medical and engineering technology to great new heights.  Google Glass  Microsoft HoloLens 2 The problem is that they’re not exactly attractive, and vanity still rules the day. Few want to be the lone wearer of large glasses on the street. Until it’s been deemed a fashion fad by a trendy designer, it's probably not going to gain much momentum. But the brains behind the AR glasses know this, and recently they’ve been making moves to team up with fashion companies to come out with something considered actually “wearable”. In collaboration with one Korean eyewear designer, Huawei announced it is entering the smart glasses market by July this year. An Amazon-backed company called North is working on a similar idea with glasses called Focals, which are expected to go on sale by the end of this year. North’s “Focals”  Source: CNBC Some media speculate that even Apple is preparing to release its augmented reality glasses next year. So, by next year we could already start seeing fewer phones and more “glasses” on the streets, and from that point, in the whirlwind of technology adoption, it’s probably not far-fetched to say we aren’t too many years away from the end of the smartphone. By Michael Scott for Safehaven.com",Safehaven,"April 10, 2019, 08:37:42 AM EDT",The Death Of Smartphones,0,0,0,0,0,1,1,-1,1,-1
64,"The Void    is coming to San Francisco: The location-based VR startup is   getting ready to open a new outpost in the Westfield San   Francisco Centre mall on the city's busy Market street this   summer,   Variety    has learned. There's no word on the exact launch date;   The   Void    didn't immediately respond to   Variety's    request for comment.  The Void    hasn't officially announced the planned San Francisco location   yet, but its future outpost near the Westfield food court already   features posters teasing a summer launch. The Void is one of a number of startups operating ticketed VR   experiences in malls and movie theaters around the world. The   company currently operates 11 such locations, with VR centers in   Las Vegas, Santa Monica, Calif. and Toronto. It has announced   plans to launch additional locations in Hollywood, New York,   Washington, D.C.   and elsewhere. makeArticleAd(); The company has partnered with Disney and Lucasfilm's ILMxLab   on a number of location-based VR experiences, including ""Ralph   Breaks VR"" and ""Star Wars: Secrets of the Empire."" In addition,   it has also produced some original content in-house, like its   horror-themed ""Nicodemus"" experience. All three were featured in   posters at its future SF location.      Related stories  'Star Trek: Dark Remnant' VR Experience Goes       Live at Dave & Buster's   VR Startup Baobab Studios Just Won Two       Daytime Emmys The Void    is coming to San Francisco: The location-based VR startup is   getting ready to open a new outpost in the Westfield San   Francisco Centre mall on the city's busy Market street this   summer,   Variety    has learned. There's no word on the exact launch date;   The   Void    didn't immediately respond to   Variety's    request for comment. The Void    hasn't officially announced the planned San Francisco location   yet, but its future outpost near the Westfield food court already   features posters teasing a summer launch. The Void is one of a number of startups operating ticketed VR   experiences in malls and movie theaters around the world. The   company currently operates 11 such locations, with VR centers in   Las Vegas, Santa Monica, Calif. and Toronto. It has announced   plans to launch additional locations in Hollywood, New York,   Washington, D.C.   and elsewhere. The company has partnered with Disney and Lucasfilm's ILMxLab   on a number of location-based VR experiences, including ""Ralph   Breaks VR"" and ""Star Wars: Secrets of the Empire."" In addition,   it has also produced some original content in-house, like its   horror-themed ""Nicodemus"" experience. All three were featured in   posters at its future SF location.   Related stories  'Star Trek: Dark Remnant' VR Experience Goes       Live at Dave & Buster's   VR Startup Baobab Studios Just Won Two       Daytime Emmys Related stories 'Star Trek: Dark Remnant' VR Experience Goes       Live at Dave & Buster's VR Startup Baobab Studios Just Won Two       Daytime Emmys",Variety,"April 09, 2019, 05:15:21 PM EDT",Location-Based VR Startup The Void to Open San Francisco Outpost,0,0,0,0,0,1,0,1,0,0
65,"Top Tech Stocks MSFT -0.59% AAPL -0.26% IBM -0.95% CSCO -0.47% GOOG -0.63% Technology stocks extended their declining this afternoon, with the shares of tech stocks in the S&P 500 losing more than 0.5% in value while the Philadelphia Semiconductor Index was falling over 1.2%. Among technology stocks moving on news: (-) Silicon Motion Technology ( SIMO  ) fell nearly 2.5% on Tuesday after the specialty chipmaker said revenue for its Q1 ended March 31 will likely miss the low-end of its forecast expecting between $97.5 million to $103.6 million by up to 5%. Analysts polled by Capital IQ, on average, are looking for $98.84 million in revenue during the January-to-March reporting period. In other sector news: (+) iQIYI ( IQ  ) was nearly 3% higher. Company founder and CEO Gong Yu participated in a panel discussion at the Committee of 100's yearly conference in Beijing and touted recent technological innovations at his company that are helping Chinese culture and entertainment firms reach broader global audiences and markets. (+) Nutanix ( NTNX  ) was posting a 2.5% advance after the enterprise cloud platform company Tuesday launched a global partnership with Hewlett Packard Enterprise Co ( HPE  ) to develop integrated hybrid cloud services. The companies will be combining H-P Enterprise's GreenLake consume-as-you-go cloud services with Nutanix's cloud operating system software. It also will allow channel partners to sell H-P enterprise servers running Nutanix software. (-) Aerojet Rocketdyne Holdings ( AJRD  ) dropped 2% after a short-seller issued a negative research report concluding the technology company faces significant challenges with both its space and defense segments. Spruce Point Capital also contends ""aggressive"" accounting methods have obscured a slowdown at the company, setting the stage for a 40% to 60% drop in its share price as low as $13 apiece.",MT Newswires,"April 09, 2019, 03:45:34 PM EDT","Technology Sector Update for 04/09/2019: SIMO,NTNX,HPE,IQ,AJRD",1,1,1,0,1,1,1,1,1,0
66,"Top Tech Stocks MSFT -0.62% AAPL +0.62% IBM -0.62% CSCO -0.40% GOOG -0.66% Technology stocks were declining in recent trading, with the shares of tech stocks in the S&P 500 losing nearly 0.3% in value while the Philadelphia Semiconductor Index was falling more than 0.9%. Among technology stocks moving on news: (+) Nutanix ( NTNX  ) was posting a 3% advance after the enterprise cloud platform company Tuesday launched a global partnership with Hewlett Packard Enterprise Co ( HPE  ) to develop integrated hybrid cloud services. The companies will be combining H-P Enterprise's GreenLake consume-as-you-go cloud services with Nutanix's cloud operating system software. It also will allow channel partners to sell H-P enterprise servers running Nutanix software. In other sector news: (+) iQIYI ( IQ  ) was nearly 4% higher. Company founder and CEO Gong Yu participated in a panel discussion at the Committee of 100's yearly conference in Beijing and touted recent technological innovations that are helping Chinese culture and entertainment firms reach broader global audiences and markets. (-) Aerojet Rocketdyne Holdings ( AJRD  ) dropped 3% after a short-seller issued a negative research report on the technology company concluding it faces significant challenges with both its space and defense segments. Spruce Point Capital also alleges ""aggressive"" accounting methods have obscured an upcoming slowdown at the company, setting the stage for a 40% to 60% drop in its share price as low as $13 apiece.",MT Newswires,"April 09, 2019, 01:51:55 PM EDT","Technology Sector Update for 04/09/2019: NTNX,HPE,IQ,AJRD",1,1,1,0,1,1,1,-1,1,-1
67," InvestorPlace - Stock Market News, Stock Advice & Trading Tips Apple (NASDAQ: AAPL ) revenue is currently dominated by iPhone sales. However, after a decade of massive growth that saw Apple stock hit record highs, that revenue stream is threatened by a softening smartphone market. AAPL has placed an emphasis on services and hardware like wearables to help replace that declining iPhone revenue. A report from analysts at Morgan Stanley suggests a shift to healthcare could actually be the big win for Apple, with the company positioned to disrupt that industry much the way it did with the music and mobile phone markets.  The kicker? Healthcare is a massive industry, worth $3.5 trillion in the U.S. alone. In less than a decade, AAPL could potentially end up with a revenue stream even larger than the iPhone. Imagine what that would do for Apple stock. Morgan Stanley analysts released a report yesterday (via Fortune ) and it's a bombshell for AAPL investors. Worries about declining iPhone revenue have hurt Apple stock and the push to make up for that with services hasn't been entirely smooth sailing, with new initiatives like Apple TV+ video streaming getting a tepid response . Morgan Stanley thinks healthcare could be the true successor to the iPhone. AAPL could leverage its extremely popular wearables - the Apple Watch and AirPods wireless earbuds - by adding more medical-grade technology. For example, adapting the AirPods to be hearing aides, or adding blood pressure monitoring capability to the Apple Watch. The hardware is just part of a growing health ecosystem Apple has developed, including the iOS Health App, and ReasearchKit, which was used by a recent Stanford study that tracked heart data for over 400,000 Apple Watch users . The company also has a $245 billion in cash on hand, which could be used to purchase a healthcare company or technology. The final piece of the puzzle is Apple's reputation for privacy protection, something other tech companies eyeing the healthcare market like Alphabet's (NASDAQ: GOOG , NASDAQ: GOOGL ) currently lack. According to the Morgan Stanley team, a successful Apple disruption of the healthcare market could pay off with anywhere from $15 billion to as much as $313 billion in new revenue by 2027. At the upper end that would not only dwarf the money AAPL makes from iPhone sales, healthcare revenue alone would eclipse the company's $265.5 billion total annual revenue for 2018. That is some serious upside for Apple stock. The idea that AAPL could monetize its growing forays into healthcare isn't new. The catalyst has been the Apple Watch. Since its introduction in 2015, AAPL has shifted the focus of the Apple Watch from being a ""computer on your wrist"" smartwatch to being a health and fitness wearable.  The latest version of the device includes integrated ECG test capability  and fall detection. Apple has been talking to Medicare providers about subsidizing the Apple Watch for seniors . In 2017, Apple acquired sleep tracking company Beddit , although it has yet to integrate that technology into the Apple Watch. The company has also hired teams of healthcare professionals as it seeks ways to boost Apple Watch adoption through features like an integrated blood glucose sensor for diabetics . The Apple Watch has become a key part of the company's push into healthcare. Morgan Stanley is suggesting the company has the pieces in place to leverage not just the Apple Watch, but also its relationship with medical researchers, its reputation for privacy protection - and its deep pockets - to make a move that could disrupt healthcare. The idea of AAPL pivoting to become a company where healthcare is a big source of revenue - if not its primary source of revenue - may seem farfetched. But the company has reinvented itself multiple times already. In the 1990s when it was a struggling computer company, few foresaw a time when Apple would disrupt the global music industry and transform into an electronics company with iTunes and the iPod. And even at the iPod's pinnacle, not many people would have pictured a company where smartphones accounted for over 60% of the company's revenue, driving Apple stock to the point of a trillion dollar market cap. Services are a big part of AAPL's future, but if the cards fall into place, healthcare could be the next big driver of Apple revenue - and it could make the iPhone era look like small potatoes in comparison. As of this writing, Brad Moon did not hold a position in any of the aforementioned securitie s. The post Why Healthcare Could Be the Next Big Thing for Apple Stock appeared first on InvestorPlace . ",InvestorPlace Media,"April 09, 2019, 01:38:47 PM EDT",Why Healthcare Could Be the Next Big Thing for Apple Stock,1,0,0,0,0,1,-1,1,1,0
