,NewsContent,author,publishedDate,title,APPL_company,IBM_company,GOOGL_company,AMZN_company,MSFT_company,APPL_senti,IBM_senti,GOOGL_senti,AMZN_senti,MSFT_senti
42,"Top Tech Stocks MSFT +0.35% AAPL +0.02% IBM +0.40% CSCO +1.21% GOOG +0.94% Technology stocks were finishing near their session highs, with the shares of tech stocks in the S&P 500 rising more than 0.6% while the Philadelphia Semiconductor Index has jumped over 1.3% higher. Among technology stocks moving on news: (-) Vonage ( VG  ) was down almost 4% in late trade, paring a more than 7% decline that followed the voice over internet protocol services company Friday saying Dennis Fois was stepping down as president of its applications operation on April 30. CEO Alan Masarek will replace Fois on an interim basis while the company looks for a permanent replacement, it said. In other sector news: (+) Smartsheet ( SMAR  ) was 4% higher after Needham began analyst coverage of the cloud-based work collaboration platform company with a buy investment recommendation and a $45 price target. (+) CalAmp ( CAMP  ) was fractionally higher on Friday after the telematics systems and software firm said the US Court of Appeals for the Federal Circuit has remanded Omega Patents' suit alleging CalAmp infringed on some of its patents back to a lower court for a new trial. (-) Infosys ( INFY  ) dropped 4% on Friday after the technology consulting and outsourcing firm forecast FY20 revenue trailing analyst estimates. The company is projecting a 7.5% to 9.5% increase in revenue during the 12 months ending next March, representing a range of INR888,756 to INR905,291 based on its INR826,750 in revenue during the just-completed FY19. Analysts, on average, are expecting a slightly more than 10% increase this year to INR910,333.",MT Newswires,"April 12, 2019, 03:58:24 PM EDT","Technology Sector Update for 04/12/2019: VG,INFY,SMAR,CAMP",1,1,1,0,1,1,0,-1,1,-1
43,"Coachella    is embracing   augmented reality    (   AR    ) with an immersive stage experience that encourages the audience   to take out their phones and participate with audio-reactive AR   filters. The experience, which has been produced by   Coachella    's digital innovation team, will debut this Friday, and will be   available during both festival weekends. ""We want to provide fun and cutting edge experiences for the   people who attend the show,"" said a spokesperson for Goldenvoice,   the company behind Coachella. ""During sets, attendees can use a   number of different AR filters that react to the audio coming out   of the speakers."" The AR experience will be available at the festival's Sahara   stage, where acts like Diplo, Jaden Smith, Kid Cudi, Whiz Califa   and Gucci Gang are scheduled to play. Audience members can access   the experience right from within the Coachella app via the   Coachela Camera option. The app also offers the ability to   capture and save photos and videos of the AR experience.makeArticleAd(); And while there will be some filters available during   performances, the experience really starts to shine during   change-overs, with Goldenvoice's spokesperson promising ""space   objects like planets, asteroids, and stars,"" space stations and a   life-size space shuttle, as well as tie-ins with a variety of   on-site installations, including one that chronicles ""the   spacefaring attempt from a group of discombobulated hippos."" The AR-enabled stage is just a first step for Goldenvoice to   bring these kinds of technologies to music festivals, according   to the company's spokesperson. ""We always like to be on the   cutting edge of technology in the space, and we'll be nimble to   change what we do depending on what is technically feasible,"" he   said.  Related stories  Magic Leap Wants to Use Blockchain Technology       to Secure Personal Data   The 12 Coachella Acts We're Most Excited to       See Coachella    is embracing   augmented reality    (   AR    ) with an immersive stage experience that encourages the audience   to take out their phones and participate with audio-reactive AR   filters. The experience, which has been produced by   Coachella    's digital innovation team, will debut this Friday, and will be   available during both festival weekends. ""We want to provide fun and cutting edge experiences for the   people who attend the show,"" said a spokesperson for Goldenvoice,   the company behind Coachella. ""During sets, attendees can use a   number of different AR filters that react to the audio coming out   of the speakers."" The AR experience will be available at the festival's Sahara   stage, where acts like Diplo, Jaden Smith, Kid Cudi, Whiz Califa   and Gucci Gang are scheduled to play. Audience members can access   the experience right from within the Coachella app via the   Coachela Camera option. The app also offers the ability to   capture and save photos and videos of the AR experience. And while there will be some filters available during   performances, the experience really starts to shine during   change-overs, with Goldenvoice's spokesperson promising ""space   objects like planets, asteroids, and stars,"" space stations and a   life-size space shuttle, as well as tie-ins with a variety of   on-site installations, including one that chronicles ""the   spacefaring attempt from a group of discombobulated hippos."" The AR-enabled stage is just a first step for Goldenvoice to   bring these kinds of technologies to music festivals, according   to the company's spokesperson. ""We always like to be on the   cutting edge of technology in the space, and we'll be nimble to   change what we do depending on what is technically feasible,"" he   said. Related stories  Magic Leap Wants to Use Blockchain Technology       to Secure Personal Data   The 12 Coachella Acts We're Most Excited to       See Related stories Magic Leap Wants to Use Blockchain Technology       to Secure Personal Data The 12 Coachella Acts We're Most Excited to       See",Variety,"April 12, 2019, 03:00:32 PM EDT",Coachella Goes AR With Immersive Stage Experience,0,0,0,0,0,1,-1,-1,-1,-1
44," InvestorPlace - Stock Market News, Stock Advice & Trading Tips Leading the Apple  (NASDAQ: AAPL ) rumor mill today is details from a recent patent. Today, we'll look at that and other Apple Rumors for Friday. Mac Face ID : A new patent from Apple mentions a system similar to Face ID working on a Mac , reports 9to5Mac . The patent describes how a camera on a Mac could be used to identify a person and automatically wake the computer up for them if it is in sleep mode. The use of this camera specifically mentions if the device is in Power Nap mode. This same patent seems to suggest that Magic Keyboards may be getting the Touch Bar. App Subscriptions : Apple is changing how users sign up for subscriptions to apps , MacRumors notes. The company is now requiring users to go through an extra step of confirmation when purchasing an app that has a renewing subscription. This includes a popup that explains how subscription apps work. It also highlights how users can cancel subscriptions to help avoid unwanted renewals. iPhone Assembly : Foxconn is preparing to start assembling another AAPL smartphone in India , reports AppleInsider . This will have the company making the iPhone X in the country. Foxconn will reportedly start making the iPhone X in India in July. This assembly is going to take place at its plant in Chennai. The post Friday Apple Rumors: AAPL Patent Mentions Face ID on Mac appeared first on InvestorPlace . ",InvestorPlace Media,"April 12, 2019, 02:31:01 PM EDT",Friday Apple Rumors: AAPL Patent Mentions Face ID on Mac,1,0,0,0,0,1,1,-1,1,-1
45,"Top Tech Stocks MSFT +0.28% AAPL -0.62% IBM +0.42% CSCO +1.04% GOOG +0.79% Technology stocks were climbing in recent trading, with the shares of tech companies in the S&P 500 rising nearly 0.5% while the Philadelphia Semiconductor Index has jumped almost 1.3%. Among technology stocks moving on news: (-) Infosys ( INFY  ) dropped 3% on Friday after the technology consulting and outsourcing firm forecast FY20 revenue trailing analyst estimates. The company is projecting a 7.5% to 9.5% increase in revenue during the 12 months ending next March, representing a range of INR888,756 to INR905,291 based on its INR826,750 in revenue during the just-completed FY19. Analysts, on average, are expecting a slightly more than 10% increase this year to INR910,333. In other sector news: (+) Smartsheet ( SMAR  ) was 4% higher after Needham began analyst coverage of the cloud-based work collaboration platform company with a buy investment recommendation and a $45 price target. (+) CalAmp ( CAMP  ) was fractionally higher on Friday after the telematics systems and software firm said the US Court of Appeals for the Federal Circuit has remanded Omega Patents' suit alleging CalAmp infringed on some of its patents back to a lower court for a new trial.",MT Newswires,"April 12, 2019, 02:10:18 PM EDT","Technology Sector Update for 04/12/2019: INFY,SMAR,CAMP",1,1,1,0,1,1,-1,0,1,-1
46," “A nation that destroys its soils destroys itself. Forests are the lungs of our land, purifying the air and giving fresh strength to our people.” ~ Franklin D. Roosevelt Forests are often dubbed as the ‘lungs of our planet’ and this defines how important they are for us. Yet over the years, the earth’s forest cover has declined at an alarming rate. Around 18.7 million acres of forest are lost annually which is equivalent to 27 soccer fields every minute. There are a number of reasons for it. While efforts have been made by conservationists, institutions and governments to combat deforestation, they have fallen short and problems still persist. In an era when advanced technologies (such as big data, cloud computing and artificial intelligence) are becoming a part of varied industries, there is increasing evidence of how these technologies can contribute towards solving globally pressing issues such as deforestation. Here’s how. Today, approximately 31 percent of the earth’s land surface is covered by forests which is equivalent to about 4 billion hectares of land. This is much lower than the pre-industrial area of 5.9 billion hectares. The main behind the decline in the green cover over the years are logging (legal and illegal), agricultural expansion, mining, urbanization and infrastructure expansion (such as roads). Illegal logging is one of the prime factors causing deforestation. The economic value of illegal logging around the world (including processing) is estimated between $30 and $100 billion according to the UN Environment Programme. According to WWF, illegal logging happens at a rate of approximately 80 percent in Peru while that in Myanmar is 85 percent and nearly 65 percent in the Democratic Republic of Congo. In addition to logging, mining activities have been causing huge damage: approximately 10 percent of the deforestation in Brazil’s Amazon between 2005 and 2015 was due to mining activities. Given the interlinkages and the delicate balance which forests maintain, the fallouts of deforestation are severe. Our forests are called the water fountains as three-quarters of the globe’s accessible freshwater comes from forested watersheds. Food and Agricultural Organization of the United Nations (FAO) reports that 40 percent of the world’s 230 major watersheds have lost more than half of their original tree cover. The Paris Climate Agreement acknowledges the crucial role of forests and trees in maintaining the earth’s temperature. The green lungs absorb (equivalent to) 2 billion tonnes of carbon dioxide each year. As the second-leading cause of climate change, deforestation accounts for nearly 20 percent of all greenhouse gas emissions — more than the world’s entire transport sector as per a report by the FAO. This is grave. “Although the pace of global deforestation has slowed since the 1990s, it remains high with about 13 million hectares (gross) lost each year. This is partially offset by reforestation, making the total annual net forest cover loss 5.6 million hectares” reads a World bank report. Advanced technologies such as AI and big data are being leveraged in the fight against deforestation. SilviaTerra is using AI to monitor forests. SilviaTerra has a software-based approach to solve forest inventory problems by assessing forests using satellite imagery and machine learning. The algorithm, powered by AI, is enabling precision forestry at a fraction of time, fieldwork and cost of conventional methods. SilviaTerra aims to build an up-to-date map of U.S. forests with detailed information about each tree. To do so, they are using Microsoft Azure (MSFT), high-resolution satellite imagery, and U.S. Forest Service inventory and analysis field data to train machine-learning models to measure forests. By analyzing forest sounds, Rainforest Connection (RFCx), a non-government organization “aims to use cell phones to stop deforestation.” The Rainforest Connection (RFCx) has built acoustic monitoring systems to protect a rainforest area by responding to real-time alerts while enhancing protections in these areas. RFCx uses TensorFlow, Google’s (GOOG, GOOGL) machine learning framework, “to analyze all the auditory data in real-time and listen for chainsaws, logging trucks and other sounds of illegal activity to pinpoint problems in the forest.” 20tree.ai is combining AI and satellite imagery powered by NVIDIA’s (NVDA) computing power to gain information into forest composition like tree species, tree height and diameter (DBH), tree growth and productivity. The forest management system by 20tree.ai allows for the monitoring of entire forests in a fraction of the time while providing near real-time intelligence into forest and wood inventory. The system is used by locals, NGO’s, corporates and governments to get actionable insights about deforestation, drought, insect plagues, soil health, storm damage, and other forest disturbances. Overall, advanced technologies such as AI and analytics have made the processing of data (collected through sensors, cameras, satellite images, drones, among other sources) faster, cost-effective, and accurate. Such information is a key to data-driven management for forests and its ecosystem. Overall, AI-based solutions are working on the idea of “better data, better decisions.""",Prableen Bajpai,"April 12, 2019, 02:06:27 PM EDT",How Big Data Can Help Fight Deforestation,0,0,0,0,0,1,0,-1,1,-1
47," By Michael Amar, Co-organizer of Paris Blockchain Week Summit and Co-founder of Chain Accelerator This year, principal blockchain projects — equipped with heightened mainstream interest — will deploy their infrastructures across the globe and choose a prime location for their European headquarters. But where will they choose: Ireland, Germany, Switzerland? Faced with a continent full of countries that have each embraced blockchain technology, it might seem harder than you think to choose an ideal home for your project. However, amid an increasingly crowded field, one country just got an incredible, €500 million headstart: France. In February, Jean-Michel Mis and Laure de La Raudière, members of the French parliament, released a report recommending investments of upwards of €500 million in blockchain, outlining 20 different proposals that will help pioneer mass adoption of the technology in the country. With this report, the French government has sent an unequivocal message to the world that France is committed to becoming the next leading blockchain nation. And since then, blockchain projects have responded positively by setting up shop in the world’s most premiere tourist destination turned technology epicenter. Below, I’d like to outline a few of the many ways that France is leading the charge for blockchain adoption in Europe, and how its forward-thinking attitude will become a leading example for emerging technologies around the world. Increasing accessibility Blockchain is often compared to the dawn of the internet. In the early 1990s, for example, it would be hard, if not impossible, for even the most ardent supporter of the Macbook to envision what the future of Apple would look like. Whether it’s 1990 or 2090, emerging technologies can be incredibly hard to understand without a foundational background in how they work and why we should use them. It’s a fact that the French government takes very seriously, which is why it has made a concerted effort to educate the general public on decentralized processes. France’s Financia Business School, for instance, recently announced that they will offer post-graduate courses in blockchain and other emerging technologies, serving as a prominent example to other universities about the importance of blockchain education Not only is this significant on its own, but Financia has also decided to allow bitcoin payments for yearly tuition fees. For any technology, mass adoption requires new researchers, developers, institutional consultants, and social enthusiasts — professions that begin at a graduate and postgraduate level. By using higher education to advocate for blockchain technology, France is not only openly advocating for blockchain integration on a mass scale, but it’s also cultivating a pool of top developers to build platforms within the country. Cooperation, not hindrance Blockchain technology rests on 40 years of academic work in mathematics, cryptography, computer science, and telecommunications. However, while its foundation may date back to concepts in the past, its applications are still relatively unknown to government agencies. At least in the near future, it will be increasingly important for government agencies to work with, instead of against, blockchain projects in an effort to remain ahead of an ever changing curve. The fact of the matter is that it will only be a matter of time before blockchain technology permeates every industry and practice area. And the sooner that regulatory bodies realize this, the more prepared they will be to pioneer the digital landscape of the future. Thankfully, equipped with forward-thinking leadership and progressive regulatory policy, France is well on its way to setting the pace for blockchain adoption worldwide. On February 23, French President Emmanuel Macron advocated for the use of blockchain technology to help revitalize supply chain management in the agricultural industry. Macron called upon foreign nations including the United States, China, and Russia to follow France’s lead in introducing new and innovative ways to track produce from farm to table. In a statement, Macron said “Let’s do this in Europe, the avant-garde of agricultural technology, by developing tools that will track every product from raw material production to packaging and processing."" Since taking office, Macron has remained vocal about his commitment to emerging technologies, announcing in 2017 that he wanted to make France a startup nation. By setting the stage for innovation, Macron and other French leaders have set an important example for future growth in the country. In sum The world is changing rapidly, even more than we may realize. The innovations of today vary drastically from the innovations of 5, 10, or even 15 years ago. Who knows what the future may hold for blockchain. One of the great beauties of this emerging technology is that its ability to transform our commercial ecosystem bears near limitless potential. However, one thing is for certain, we won’t get anywhere unless we have the support of government agencies looking to see blockchain adoption develop. With France leading the way, I truly believe we will experience the social momentum necessary to bring blockchain to new heights. So the next time someone asks what the great tech epicenters are, you’d be wise to include France in your answer.",Guest Contributors,"April 12, 2019, 09:51:16 AM EDT",How France is Becoming a Blockchain Epicenter in Europe,0,0,0,0,0,1,0,-1,1,1
48,"Top Technology Stocks: MSFT: +0.57% AAPL: +0.54% IBM: +0.34% CSCO: +0.63% GOOG: +0.46% Tech giants were trading higher pre-bell Friday. Stocks moving on news include: (-) Infosys ( INFY  ), which was down more than 3% as i t report  ed fiscal Q4 2019 adjusted earnings of $0.13 per share, flat with $0.13 in the same period a year ago and in line with the estimate of $0.13 from analysts polled by Capital IQ. In other sector news: (=) CalAmp ( CAMP  ), which is being sued by Omega Patents for alleged patent infringement, said the US Court of Appeals for the Federal Circuit has remanded the case for a new trial. CalAmp was unchanged after the news. (+) Sabre ( SABR  ) was marginally higher after it signed a new content distribution agreement with Firefly, a subsidiary of Malaysia Airlines.",MT Newswires,"April 12, 2019, 08:59:07 AM EDT","Technology Sector Update for 04/12/2019: INFY, CAMP, SABR, MSFT, AAPL, IBM, CSCO, GOOG",1,1,1,0,1,1,1,-1,1,-1
49,"Top Tech Stocks MSFT -0.13% AAPL -0.80% IBM +0.30% CSCO -0.42% GOOG +0.06% Technology stocks reversed course in recent trade, with the shares of tech stocks in the S&P 500 dropping nearly 0.3% while the Philadelphia Semiconductor Index also was falling almost 0.3%. Among technology stocks moving on news: (-) Gogo ( GOGO  ) fell over 3% this afternoon. The company Thursday sought to refute speculation by certain analysts it used Intelsat's ( I  ) 29e satellite to provide airline customers with broadband connectivity during flights. Intelsat Wednesday said it lost communication with the three-year-old satellite on Tuesday while working to repair damage from an April 7 incident. But Gogo was not affected by the resulting outage, it said, after shifting capacity from the 29e satellite in 2017. In other sector news: (+) Pluralsight ( PS  ) climbed 5% on Thursday after the machine-learning company said it was collaborating with Microsoft ( MSFT  ) to provide new benefits to Visual Studio 2019 subscribers, who also will receive free access to Pluralsight's technology skills platform. The company also released Visual Studio 2019 Skill IQ so developers can measure their proficiency and access coursework helping them learn new skills. (+) GoDaddy ( GDDY  ) rose 4% after the website-hosting company said it acquired privately held Sellbrite, which operates a multi-channel e-commerce management platform supporting its new Marketplaces feature for the GoCentral online store. Marketplaces allows US customers to list and sell their store inventories online through Amazon.com (AMZN), eBay (EBAY), Etsy (ETSY) and Walmart.com (WMT) all from a single location. (-) Key Tronic (KTCC) dropped more than 8% after the electronics manufacturer lowered its fiscal Q3 forecast to account for a goodwill writedown and severance costs, now expecting a net loss in a range of $1.10 to $1.20 per share compared with its prior outlook expecting a $0.13 per share to $0.18 per share profit. It also is projecting about $108 million in revenue for the three months ended March 31, down from its previous guidance expecting between $120 million to $125 million. Analyst estimates were not available.",MT Newswires,"April 11, 2019, 03:44:40 PM EDT","Technology Sector Update for 04/11/2019: GOGO,I,PS,MSFT,GDDY,KTCC,AMZN,EBAY,ETSY,WMT",1,1,1,0,1,1,0,-1,1,-1
50," InvestorPlace - Stock Market News, Stock Advice & Trading Tips Leading the Apple  (NASDAQ: AAPL ) rumor mill today is news of an investigation for the tech company. Today, we'll look at that and other Apple Rumors for Thursday. Dutch Investigation : Apple is facing an investigation from a Dutch antitrust watchdog , reports MacRumors . The watchdog group is looking to see if AAPL is giving its own apps in the App Store preferential treatment over those made by other developers. The tech company has already responded to the investigation announcement. It says that it is ""confident"" the investigation will find that it gives all developers the same treatment. iTunes Future : A recent report claims that iTunes will still be around after standalone apps launch for Mac , reports 9to5Mac . This report notes that even after the release of the rumored Books, Podcasts and Music apps, iTunes will still remain as its own app. However, the report claims that the tech company is likely to stop future development of the app in favor of focusing on the standalone ones. Lawsuit : Apple is facing a new lawsuit that claims it is infringing on a large amount of patents , reports AppleInsider . This lawsuit comes from Seven Networks and was filed in the Eastern District Court of Texas. The lawsuit claims that AAPL is infringing on 16 of its patents. This isn't the first time the tech company has had to deal with patent lawsuits in this area. It's likely one of the reasons that is is closing its physical stores in the district to avoid similar lawsuits. The post Thursday Apple Rumors: Apple Facing Investigation from Dutch Antitrust Group appeared first on InvestorPlace . ",InvestorPlace Media,"April 11, 2019, 02:15:13 PM EDT",Thursday Apple Rumors: Apple Facing Investigation from Dutch Antitrust Group,1,0,0,0,0,1,1,-1,1,-1
